{
  "id": "2026-coldcard-rng-seed-flaw",
  "slug": "coldcard-rng-seed-entropy-flaw-2026",
  "title": "Coldcard seed-entropy flaw: ~$116M+ swept from wallets with device-generated seeds",
  "summary": "A firmware bug shipped in March 2021 (v4.0.1) made Coldcard devices generate seeds from a weak software PRNG instead of the hardware RNG, cutting effective entropy to ~40 bits (Mk2/Mk3) or ~72 bits (Mk4/Mk5/Q). Starting July 30, 2026, attackers brute-forced and swept roughly 1,816 BTC (~$116M, still rising) from 5,200+ addresses. Updating firmware does NOT fix an existing seed — affected users must generate a new seed on patched firmware and move funds now.",
  "trustState": "verified",
  "severity": "S1",
  "ongoing": true,
  "categories": ["vulnerability", "theft"],
  "firstObserved": "2026-07-30",
  "published": "2026-08-08",
  "lastUpdated": "2026-08-08",
  "entities": {
    "vendor": "Coinkite",
    "products": ["Coldcard Mk2", "Coldcard Mk3", "Coldcard Mk4", "Coldcard Mk5", "Coldcard Q"]
  },
  "impact": {
    "lossUSD": 116000000,
    "lossNative": "~1,816 BTC (some trackers report $130M+)",
    "victims": "5,200+ addresses",
    "confidence": "rising",
    "asOf": "2026-08-05",
    "source": "https://www.trmlabs.com/resources/blog/the-largest-hardware-wallet-exploit-of-2026-inside-the-usd-116-million-coldcard-hack"
  },
  "timeline": [
    { "date": "2021-03", "event": "Firmware v4.0.1 ships with libngu migration; a #ifndef preprocessor bug silently compiles in MicroPython's Yasmarang software PRNG for seed generation instead of the hardware RNG.", "source": "https://blog.coinkite.com/entropy-technical-backgrounder/" },
    { "date": "2026-07-30", "event": "First theft wave: ~594 BTC swept in ~25 minutes (initial sweep tracked at 1,082.65 BTC / ~$70.2M from 1,196 addresses in 41 minutes). Coinkite publishes security advisory the same day.", "source": "https://thehackernews.com/2026/08/coldcard-hardware-wallet-flaw-linked-to.html" },
    { "date": "2026-07-31", "event": "Coinkite releases emergency patched firmware (Mk2/Mk3: 4.2.0; Mk4/Mk5: 5.6.0; Q: 1.5.0Q). Patch prevents new weak seeds only — existing seeds remain vulnerable.", "source": "https://blog.coinkite.com/coldcard-mk3-seed-generation-warning/" },
    { "date": "2026-08-01", "event": "Advisory updated; four theft waves documented over four days, transaction-construction differences suggest multiple attackers.", "source": "https://www.trmlabs.com/resources/blog/the-largest-hardware-wallet-exploit-of-2026-inside-the-usd-116-million-coldcard-hack" },
    { "date": "2026-08", "event": "Secondary phishing wave: fake 'hardware audit' emails impersonating Coldcard push ScreenConnect remote-access malware. See related incident.", "source": "https://decrypt.co/374891/hardware-wallet-firms-warn-of-phishing-surge-as-coldcard-losses-near-130m" }
  ],
  "affected": [
    "Seeds GENERATED ON-DEVICE with: Mk2/Mk3 firmware 4.0.1–4.1.9 (~40 bits effective entropy)",
    "Mk4/Mk5 firmware before 5.6.0, Edge before 6.6.0X (~72 bits)",
    "Coldcard Q firmware before 1.5.0Q, Edge before 6.6.0QX"
  ],
  "notAffected": [
    "Seeds generated with 50+ dice rolls (dice mode bypasses the device RNG entirely)",
    "Seeds imported from elsewhere (the bug is in generation, not storage/signing)",
    "Funds behind a strong, unique BIP-39 passphrase (Coinkite still recommends migrating)",
    "TAPSIGNER, OPENDIME, SATSCARD products"
  ],
  "actions": [
    "If an affected Coldcard ever GENERATED your seed: treat it as compromised. Move funds to a new wallet today — do not wait.",
    "Update firmware FIRST, then generate the fresh seed on the patched device (or use dice-roll mode / another device), then sweep funds to the new wallet.",
    "Updating firmware alone does NOT protect an existing seed. The seed itself is weak; only a new seed fixes it.",
    "Prefer dice-roll seed generation going forward — 50+ rolls for 12 words, 99+ for 24. See our entropy guide.",
    "Ignore every email/DM offering a 'hardware audit', 'seed check', or 'migration help'. Coinkite will never ask for your seed. Type coinkite.com manually; never click sponsored search results for firmware."
  ],
  "claims": [
    { "claim": "Root cause: MICROPY_HW_ENABLE_RNG set to 0 but guarded with #ifndef (checks existence, not value), so the software PRNG fallback compiled in silently.", "status": "primary-confirmed", "attribution": "Coinkite technical backgrounder", "sources": ["https://blog.coinkite.com/entropy-technical-backgrounder/"] },
    { "claim": "The buggy libngu code was authored by Coinkite co-founder/CTO Peter Gray under the pseudonymous GitHub account 'Switch'.", "status": "reported-unconfirmed", "attribution": "Media and social reports; not confirmed by Coinkite", "sources": ["https://www.cryptopolitan.com/coinkite-cto-peter-gray-linked-coldcard-hack/"] },
    { "claim": "Developer James O'Beirne warned Coinkite of exactly this class of defect in May 2025 and was dismissed.", "status": "reported-unconfirmed", "attribution": "James O'Beirne (public statements); not confirmed by Coinkite", "sources": ["https://www.cryptopolitan.com/coinkite-cto-peter-gray-linked-coldcard-hack/"] },
    { "claim": "No attribution of the thefts; funds mostly pooled with minimal laundering observed as of Aug 5, 2026.", "status": "primary-confirmed", "attribution": "TRM Labs on-chain analysis", "sources": ["https://www.trmlabs.com/resources/blog/the-largest-hardware-wallet-exploit-of-2026-inside-the-usd-116-million-coldcard-hack"] }
  ],
  "relatedGuides": ["seed-phrase-entropy"],
  "relatedIncidents": ["2026-coldcard-phishing-wave", "2023-milk-sad-libbitcoin"],
  "sources": [
    { "url": "https://blog.coinkite.com/coldcard-mk3-seed-generation-warning/", "publisher": "Coinkite (official advisory)", "date": "2026-07-30", "type": "vendor" },
    { "url": "https://blog.coinkite.com/entropy-technical-backgrounder/", "publisher": "Coinkite (technical backgrounder)", "date": "2026-08-01", "type": "vendor" },
    { "url": "https://coinkite.com/historical-disclosures", "publisher": "Coinkite", "type": "vendor" },
    { "url": "https://www.trmlabs.com/resources/blog/the-largest-hardware-wallet-exploit-of-2026-inside-the-usd-116-million-coldcard-hack", "publisher": "TRM Labs", "date": "2026-08-05", "type": "research" },
    { "url": "https://thehackernews.com/2026/08/coldcard-hardware-wallet-flaw-linked-to.html", "publisher": "The Hacker News", "date": "2026-08-04", "type": "news" },
    { "url": "https://techcrunch.com/2026/08/04/hackers-steal-over-130-million-by-exploiting-bug-in-offline-hardware-wallets/", "publisher": "TechCrunch", "date": "2026-08-04", "type": "news" },
    { "url": "https://fortune.com/2026/08/03/bitcoin-owners-116-million-hack-coldcard-coinkite-exploit/", "publisher": "Fortune", "date": "2026-08-03", "type": "news" },
    { "url": "https://www.cbc.ca/news/world/bitcoin-coinkite-security-hack-9.7295582", "publisher": "CBC News", "type": "news" }
  ],
  "tags": ["coldcard", "coinkite", "hardware-wallet", "entropy", "prng", "seed-phrase", "brute-force"]
}
