{
  "id": "2023-milk-sad-libbitcoin",
  "slug": "milk-sad-libbitcoin-explorer-weak-entropy",
  "title": "Milk Sad: Libbitcoin Explorer's 32-bit wallet entropy drained ~$900K+ (CVE-2023-39910)",
  "summary": "Libbitcoin Explorer's 'bx seed' command generated wallet entropy with a Mersenne Twister PRNG seeded by just 32 bits of system time. Every wallet it ever made was brute-forceable; coordinated theft in July 2023 took $900K+. The historical twin of the 2026 Coldcard flaw: a software PRNG silently standing in for real entropy.",
  "trustState": "resolved",
  "severity": "S4",
  "ongoing": false,
  "categories": ["vulnerability", "theft"],
  "firstObserved": "2023-07-12",
  "published": "2026-08-08",
  "lastUpdated": "2026-08-08",
  "entities": {
    "vendor": "Libbitcoin",
    "products": ["Libbitcoin Explorer 3.x ('bx seed')"]
  },
  "impact": {
    "lossUSD": 900000,
    "confidence": "estimated",
    "asOf": "2023-08-08",
    "source": "https://milksad.info/disclosure.html"
  },
  "timeline": [
    { "date": "2023-07-12", "event": "Coordinated on-chain theft drains wallets generated by 'bx seed'.", "source": "https://milksad.info/disclosure.html" },
    { "date": "2023-08-08", "event": "Distrust research team publishes disclosure as CVE-2023-39910; 'Milk Sad' name comes from the first two BIP39 words of the PRNG's zero-time output.", "source": "https://milksad.info/" }
  ],
  "affected": ["Any wallet whose seed came from Libbitcoin Explorer 3.x 'bx seed'"],
  "notAffected": ["Wallets with entropy from proper CSPRNGs or physical dice"],
  "actions": [
    "If you ever generated a wallet with 'bx seed': assume it is compromised; move any remaining funds immediately.",
    "Lesson for everyone else: wallet entropy must come from hardware RNG or physical randomness you can verify — never from a general-purpose PRNG. See our entropy guide."
  ],
  "relatedGuides": ["seed-phrase-entropy"],
  "relatedIncidents": ["2026-coldcard-rng-seed-flaw"],
  "sources": [
    { "url": "https://milksad.info/", "publisher": "Milk Sad research team (Distrust)", "date": "2023-08-08", "type": "research" },
    { "url": "https://milksad.info/disclosure.html", "publisher": "Milk Sad research team (Distrust)", "date": "2023-08-08", "type": "primary" }
  ],
  "aliases": ["Milk Sad", "CVE-2023-39910", "Libbitcoin Explorer bx seed flaw"],
  "phrases": ["milk sad vulnerability", "bx seed wallet hack", "libbitcoin explorer wallet stolen", "bx seed safe to use"],
  "tags": ["libbitcoin", "bx", "entropy", "prng", "cve-2023-39910", "milk-sad"]
}
